{
  "matrix": {
    "cells": 28,
    "complete": true,
    "methods": 14,
    "tracks": 2
  },
  "publication": {
    "classification": "research_only",
    "gate": "closed",
    "leaderboard_publish": false,
    "public_export_allowed": false,
    "publish": false,
    "restricted_content_allowed": false
  },
  "schema_version": "bright-cross-paradigm-summary-v1",
  "story_id": "S-20260814-009",
  "track_aggregation": "independent_no_cross_track_micro_average_or_universal_winner",
  "tracks": {
    "economics": {
      "methods": [
        {
          "cell_sha256": "954ceb8d3e3a3217dbac5e71cdad99d54c34136a3c88a9ba18a7a0129c826ba0",
          "confidence_intervals": {
            "map@100": {
              "high": 0.23771444213611953,
              "low": 0.14322694584506945,
              "mean": 0.18899597647375369,
              "samples": 10000,
              "seed": 20260826
            },
            "mrr@10": {
              "high": 0.3716389274156263,
              "low": 0.22391065649560796,
              "mean": 0.29590846047156727,
              "samples": 10000,
              "seed": 20260826
            },
            "ndcg@10": {
              "high": 0.31506751328782945,
              "low": 0.1934486604691144,
              "mean": 0.2527691584497037,
              "samples": 10000,
              "seed": 20260826
            },
            "recall@10": {
              "high": 0.35027571784973577,
              "low": 0.20868465320552845,
              "mean": 0.2775034937753985,
              "samples": 10000,
              "seed": 20260826
            },
            "recall@100": {
              "high": 0.5856217779429206,
              "low": 0.42445262629607844,
              "mean": 0.504824817301408,
              "samples": 10000,
              "seed": 20260826
            }
          },
          "family": "lexical",
          "method_key": "bm25-unicode",
          "metrics": {
            "map@100": 0.18899597647375369,
            "mrr@10": 0.29590846047156727,
            "ndcg@10": 0.2527691584497037,
            "recall@10": 0.27750349377539857,
            "recall@100": 0.504824817301408
          },
          "quality_origin": "s005_method_representation_backed_return1_rerun"
        },
        {
          "cell_sha256": "cc51d4618cc94e25dbaf9afb74790d0c5c25d9647f5535990410560bb8a19d3e",
          "confidence_intervals": {
            "map@100": {
              "high": 0.16720435479665574,
              "low": 0.08699100929795554,
              "mean": 0.12453956889116215,
              "samples": 10000,
              "seed": 20260826
            },
            "mrr@10": {
              "high": 0.23077178687008768,
              "low": 0.11776381183541376,
              "mean": 0.17132454923717058,
              "samples": 10000,
              "seed": 20260826
            },
            "ndcg@10": {
              "high": 0.2120559687558365,
              "low": 0.11103015073124843,
              "mean": 0.15891337528156685,
              "samples": 10000,
              "seed": 20260826
            },
            "recall@10": {
              "high": 0.2566320945240575,
              "low": 0.13062844240001426,
              "mean": 0.19100095681999846,
              "samples": 10000,
              "seed": 20260826
            },
            "recall@100": {
              "high": 0.546059851398074,
              "low": 0.3836532718583169,
              "mean": 0.4647266542580041,
              "samples": 10000,
              "seed": 20260826
            }
          },
          "family": "lexical",
          "method_key": "tfidf-word-sublinear",
          "metrics": {
            "map@100": 0.12453956889116213,
            "mrr@10": 0.1713245492371706,
            "ndcg@10": 0.15891337528156685,
            "recall@10": 0.19100095681999843,
            "recall@100": 0.46472665425800413
          },
          "quality_origin": "new_frozen_formal_run"
        },
        {
          "cell_sha256": "1a46bca58bc4a187707b498a0dd68fbbd730e2c14d51f62810c467ac18bdcce1",
          "confidence_intervals": {
            "map@100": {
              "high": 0.2589877537568217,
              "low": 0.15100611026662963,
              "mean": 0.20298451133871415,
              "samples": 10000,
              "seed": 20260826
            },
            "mrr@10": {
              "high": 0.34330414932963477,
              "low": 0.19928908537525047,
              "mean": 0.2692209893666204,
              "samples": 10000,
              "seed": 20260826
            },
            "ndcg@10": {
              "high": 0.3199941699709326,
              "low": 0.19153242667595413,
              "mean": 0.25435245932509953,
              "samples": 10000,
              "seed": 20260826
            },
            "recall@10": {
              "high": 0.3788473472701471,
              "low": 0.2288701422565342,
              "mean": 0.3024988520607565,
              "samples": 10000,
              "seed": 20260826
            },
            "recall@100": {
              "high": 0.7236160892376352,
              "low": 0.5707597533029283,
              "mean": 0.6491597537705875,
              "samples": 10000,
              "seed": 20260826
            }
          },
          "family": "dense",
          "method_key": "bge-m3-dense",
          "metrics": {
            "map@100": 0.20298451133871412,
            "mrr@10": 0.2692209893666204,
            "ndcg@10": 0.25435245932509953,
            "recall@10": 0.30249885206075655,
            "recall@100": 0.6491597537705875
          },
          "quality_origin": "s005_method_representation_backed_return1_rerun"
        },
        {
          "cell_sha256": "4fa8903a88a68b7faa6d3dab69fd21fac1bf6e4716883298ac8078f99729b699",
          "confidence_intervals": {
            "map@100": {
              "high": 0.27087345393967327,
              "low": 0.15849987516381855,
              "mean": 0.21183475864784734,
              "samples": 10000,
              "seed": 20260826
            },
            "mrr@10": {
              "high": 0.3560015988596085,
              "low": 0.21370704268762522,
              "mean": 0.2827053475111727,
              "samples": 10000,
              "seed": 20260826
            },
            "ndcg@10": {
              "high": 0.3291388480793636,
              "low": 0.2015665698554776,
              "mean": 0.2631969959077389,
              "samples": 10000,
              "seed": 20260826
            },
            "recall@10": {
              "high": 0.3792911887288164,
              "low": 0.22929253546957287,
              "mean": 0.3024280021991038,
              "samples": 10000,
              "seed": 20260826
            },
            "recall@100": {
              "high": 0.7118975141582499,
              "low": 0.5631810098634857,
              "mean": 0.63870050192325,
              "samples": 10000,
              "seed": 20260826
            }
          },
          "family": "dense",
          "method_key": "all-minilm-l6-v2",
          "metrics": {
            "map@100": 0.2118347586478473,
            "mrr@10": 0.28270534751117277,
            "ndcg@10": 0.26319699590773876,
            "recall@10": 0.3024280021991039,
            "recall@100": 0.63870050192325
          },
          "quality_origin": "new_frozen_formal_run"
        },
        {
          "cell_sha256": "e8a8f9ac2aa59e2e819b64dbc3cc189b04b880330658aedf5d9ad5b218daeca1",
          "confidence_intervals": {
            "map@100": {
              "high": 0.26157627159968094,
              "low": 0.15663088647564594,
              "mean": 0.20709281063904442,
              "samples": 10000,
              "seed": 20260826
            },
            "mrr@10": {
              "high": 0.3698385729696408,
              "low": 0.22069617814763448,
              "mean": 0.2932963476652797,
              "samples": 10000,
              "seed": 20260826
            },
            "ndcg@10": {
              "high": 0.32386934512668586,
              "low": 0.1988561963192649,
              "mean": 0.2595328092636765,
              "samples": 10000,
              "seed": 20260826
            },
            "recall@10": {
              "high": 0.37089914881978625,
              "low": 0.2245637923629153,
              "mean": 0.2952049380383892,
              "samples": 10000,
              "seed": 20260826
            },
            "recall@100": {
              "high": 0.7485537390433634,
              "low": 0.6013131948649295,
              "mean": 0.6767143776183396,
              "samples": 10000,
              "seed": 20260826
            }
          },
          "family": "learned_sparse",
          "method_key": "granite-30m-sparse",
          "metrics": {
            "map@100": 0.2070928106390444,
            "mrr@10": 0.2932963476652797,
            "ndcg@10": 0.25953280926367644,
            "recall@10": 0.2952049380383892,
            "recall@100": 0.6767143776183396
          },
          "quality_origin": "accepted_read_only"
        },
        {
          "cell_sha256": "7d2caaf6f3659ca896e6406b597f40594baf804472ccdfd45feb0995ce3c3d88",
          "confidence_intervals": {
            "map@100": {
              "high": 0.2533521753233598,
              "low": 0.1429795054502432,
              "mean": 0.1964300547419144,
              "samples": 10000,
              "seed": 20260826
            },
            "mrr@10": {
              "high": 0.3669771921713669,
              "low": 0.21028663892741564,
              "mean": 0.28720141778394204,
              "samples": 10000,
              "seed": 20260826
            },
            "ndcg@10": {
              "high": 0.3168027469347164,
              "low": 0.1829977648598852,
              "mean": 0.2484155572580241,
              "samples": 10000,
              "seed": 20260826
            },
            "recall@10": {
              "high": 0.34594448018942286,